author,published,site_url,label,title_without_stopwords,text_without_stopwords
Alex Ansary,2016-11-02T18:36:20.532+02:00,amtvmedia.com,Fake,Russias potent weapon hoarding gold.,Wikileaks documents reveal united nations interest ufos huffington revelations hacked emails released wikileaks sparked conversations ufos speculation extraterrestrials visiting earth overlooked wikileaks items relevant topic released wikileaks posted half million state department diplomatic documents detailing americas interactions countries world grenada prime minister eric gairys efforts organize united nationsbased committee research investigate global ufo reports documents American indicated closely monitoring grenadas uforelated activities document nov involvement helping grenada produce credible ufo presentation opportunity gairy york present idea attention ufo crusade ambassadors copy documentary record album ufos credibility factor produced cbs inc gairy convinced credible speakers agreed proposal.
Alex Ansary,2016-11-02T18:36:20.940+02:00,amtvmedia.com,Fake,China airport security robot gives electroshocks.,Suspect captured ambushstyle killings iowa cops USA authorities captured yearold male suspect incident hours earlymorning ambushstyle killing police officers des moines metro area suspect backtoback killings identified scott michael greene urbandale police sgt chad underwood capturing police described greene driving blue ford iowa license plate armed greene custody dallas county sheriffs department walking rural road redfield miles west shootings occurred police greene flagged passing department natural resources officer handed officer police shots fired struggle police suspect ambulance des moines hospital unknown injury conference police identified slain officers urbandale police officer justin martin des moines police sgt anthony tony beminio attacks began police departments cities responded reports gunfire intersection street aurora avenue urbandale officers arriving scene martin fatally wounded minutes miles away beminio shot intersection merle hay road sheridan ave responding reports officers shooting beminio transported iowa methodist medical center died scott michael greene.
Alex Ansary,2016-11-02T18:47:19.431+02:00,amtvmedia.com,Fake,Wikileaks documents reveal united nations interest ufos.,Bundy brothers discharged oregon jail headed nevada marshals oregonlive ammon bundy older brother ryan bundy acquitted federal conspiracy weapon charges takeover malheur national wildlife refuge longer custody downtown portland jail bundys discharged multnomah county detention center custody marshals service jail spokeswoman flown nevada theyre among indicted federal charges armed standoff federal agents grazing father cliven bundys ranch nevada face felony counts extortion obstruction justice conspiracy commit offense United States conspiracy impede injure federal officer assault federal officer threatening federal officer.
Alex Ansary,2016-11-02T19:14:58.033+02:00,amtvmedia.com,Fake,Suspect captured ambushstyle killings iowa cops.,Warning threat Hillary hints second civil war Trump wins speaking supporters cincinnati Democrat Hillary Clinton hinted second civil war gop nominee Donald Trump wins charlie spiering divisive vision America tear country apart Clinton supporters cincinnati ohio halloween Clinton referred civil war suggesting country faced threat divisiveness Donald Trump abraham lincoln house divided cannot greatest challenges challenge posed slavery fought civil war warned voters country divisions country seriously also stock divided kinds divisions healed together failing admit divided America race class gender also claimed Trump nuclear war foreign leader skin discussion topic fearmongering dont rally kent ohio barracuda brigade observed liberals Clinton always projecting anything accuse suggests message change fact Trump great talking policies issues Clinton done nothing engage fearmongering fingerpointing clintons hint warning threat.
Alex Ansary,2016-11-02T19:14:58.593+02:00,amtvmedia.com,Fake,Bundy brothers discharged oregon jail headed nevada marshals.,Militia girds trouble presidential election nears reuters georgia country road camouflaged members percent security force mobilized rifle practice handtohand combat training impromptu campaign rally Republican presidential candidate Donald Trump voting Trump oohrah asks chris hill paralegal code bloodagent oohrah shout dozen militia members response sunlight sifted trees weekend divisive presidential election memory nears conclusion armed militia groups preparing possibility stolen election nov civil unrest days following victory Democrat Hillary Clinton wont fire shot theyre planning guns trumps populist campaign energized militia members hill admire Republican moguls promise deport illegal immigrants muslims entering country wall mexico border Trump repeatedly warned election rigged respect results least paramilitary oath keepers members monitor voting sites signs fraud armed paramilitary groups gained prominence fueled confrontations ruby ridge idaho waco texas culminating militia sympathizers bombing federal office building oklahoma city numbers dwindled following attack spiked years driven fears president barack Obama threaten gun ownership erode power local government southern poverty law center tracks extremist groups estimates active militias years armed groups confronted federal authorities series landuse disputes western United States federal fear clashes militants acquitted conspiracy charges occupying federal wildlife refuge oregon fear Clinton push county chance America ruin hill able survive suffer years Obama going insane Hillary going extremist groups emboldened oath keepers prominent antigovernment force guntoting members race riots ferguson missouri members monitor voting sites election signs fraud hour south atlanta percent security force campfire taking turns shooting automatic pistols rifles makeshift target range whooped approval blasts members highpowered rifle knocked tree operates independently affiliated national armed movement calls members defend individual face overreaching federal government movement draws notion percent American population fought revolutionary war britain amid war games hill weighed plans armed Washington Clinton wins doesnt members leading defend protesters hesitate act president Clinton tries disarm gun owners render assistance fellow countrymen prevent disarmed fight die process hill founded militia years trumps candidacy emboldened extremist groups openly challenging rule law ryan lenz researcher southern poverty law center prior campaign season ideas relegated political fringe American political landscape ideas legitimized prominent Trump supporters hinted violence Trump loses grabbing musket former illinois joe walsh conservative commentator wayne root fantasized clintons death speaking Trump rally las vegas georgia percent security force wrapped rifle practice midday sun headed trees tackle obstacle course loaded pistols sides whatever weve building marines going train harder increase operational capabilities event never.
Alex Ansary,2016-11-02T19:24:00.901+02:00,amtvmedia.com,Fake,Warning threat Hillary hints second civil war Trump wins.,Donald Trump kgb spy todays christopher greene amtv reports Hillary Clinton campaign accusation Donald Trump kgb spy baseless claim salem witch hunt mccarthy era Hillary Clinton losing lobbing conspiracy theory citizen quasar things Trump landslide election stolen.
Alex Ansary,2016-11-02T19:24:01.278+02:00,amtvmedia.com,Fake,Militia girds trouble presidential election nears.,Putin grants steven seagal Russian citizenship daily mail president vladimir Putin signed decree granting Russian citizenship American action hero actor steven seagal latest highprofile passport handout western celebrity hollywood star seagal judoloving kremlin tough guy Putin struck bromance years seagal visiting Russia repeatedly defending moscows annexation crimea ukraine asking insistently lengthy period granted citizenship kremlin dmitry peskov journalists well feelings country never dual citizenship Americans allowed hold dual citizenship steven seagal Russia law mention dual nationality citizens nationality citizens pledge loyalty renouncing allegiances symbolic contractual cases citizen forfeit citizenship becoming citizen nation instances American citizen joins armed forces foreign nation declaration allegiance foreign state express purpose relinquishing nationality seagal latest string highprofile westerners granted Russian citizenship buddying Putin veteran french actor gerard depardieu Russian passport star tax exile ire rate hikes native country Putin also handed citizenship American boxer roy jones sipping tea crimea American mixed martial artist jeff monson seagals fame peaked films siege law remains hugely eastern europe granted serbian citizenship depardieu previously hung Putin fellow martial arts fan strongmen leaders former soviet union russias annexation crimea seagal Putin great living world leaders performed blues band annexed black sea peninsula veteran belarussian leader alexander lukashenko seagal eat homegrown carrots awkward encounter drew mockery online.
Alex Ansary,2016-11-03T03:45:27.666+02:00,amtvmedia.com,Fake,Donald Trump kgb spy.,Msm caught preparing Hillary victory results prior election todays christopher greene amtv reports mainstream caught preparing Hillary Clinton election results prior juror explanation ammon bundy verdict oregonlive juror public explanation behindthescenes discussions doug casey civil war cards election lew rockwell.
Alex Ansary,2016-11-03T21:03:58.143+02:00,amtvmedia.com,Fake,Putin grants steven seagal Russian citizenship.,Julian assange prerecorded todays christopher greene amtv reports prerecorded julian assange aired prior election juror explanation ammon bundy verdict oregonlive juror public explanation behindthescenes discussions doug casey civil war cards election lew rockwell.
Alex Ansary,2016-11-04T02:44:43.932+02:00,amtvmedia.com,Fake,Msm caught preparing Hillary victory results prior election.,Analyst Americans candidate press Democratic presidential candidate Hillary clintons unpopularity among American voters polls putting par Republican rival Donald Trump final preelection york timescbs poll released overwhelming majority American voters disgusted state politics Trump Clinton dishonest percent voters presidential campaign repulsed poll hated politicians running president representing largest political parties mockery democracy electoral process hoenig press Hillary Clinton lied stole nomination democrats Trump bullied insulting interest America fellow Republican opponents third parties gary johnson libertarian party laughing stock ignorance foreign poll numbers dropping party candidate jill stein green party seeing actual rise numbers spite lies smears coming mostly democrats assistance stream race tightening surprise often happens reasons becoming assured disgusted choices stated regardless wins probable itll Clinton Trump countrys nightmare begin jan inauguration Clinton wouldnt ink articles impeachment isnt dried criminal charges presented presidential pardon outgoing president Obama analyst noted president ford leader house representatives impeachment whatever Congress wants simply whiff impropriety criminal behavior partisan congressman reason impeachment compound actual indictment guaranteed commentator Trump problems inaugurated positions outlandish party rejected pounce anything jeopardize chances party individually offyear elections inward nation degenerated point majority Americans candidate concluding remarks.
Alex Ansary,2016-11-04T02:44:44.106+02:00,amtvmedia.com,Fake,Julian assange prerecorded.,Crack earths magnetic shield detected dna india worlds largest sensitive cosmic ray monitor located india recorded burst galactic cosmic rays indicates crack earths magnetic shield scientists burst occurred giant cloud plasma ejected solar corona struck earth speed causing massive compression earths magnetosphere triggering severe geomagnetic storm grapes muon telescope located tata institute fundamental researchs cosmic ray laboratory ooty tamil nadu recorded burst galactic cosmic rays gev lasting hours burst occurred giant cloud plasma ejected solar corona moving speed million kilometres per hour struck causing severe compression earths magnetosphere times radius earth triggered severe geomagnetic storm generated aurora borealis radio signal blackouts latitude countries study published journal physical letters earths magnetosphere extends radius million kilometres acts line defence shielding continuous flow solar galactic cosmic rays protecting life intensity energetic radiations numerical simulations performed grapes researchers pravata mohanty indicate earths magnetic shield temporarily cracked occurrence magnetic reconnection allowing lower energy galactic cosmic ray particles atmosphere earths magnetic field bent particles degree dayside nightside earth detected burst grapes muon telescope midnight data analysed interpreted extensive simulation weeks using core computing farm inhouse grapes physicists engineers cosmic ray laboratory ooty solar storms cause disruption human civilisation crippling electrical power grids global positioning systems gps satellite operations communications.
Alex Ansary,2016-11-04T22:44:05.359+02:00,amtvmedia.com,Fake,Analyst Americans candidate.,Feds warn nyc qaeda attack york york city law enforcement authorities alert receiving warning feds attack qaeda eve election.
Alex Ansary,2016-11-04T22:44:05.725+02:00,amtvmedia.com,Fake,Crack earths magnetic shield detected.,Bill Clinton Hillary lolita express pedophilia ring todays christopher greene amtv breaks connection convicted felon jefferey epstein pedophile clintons shoe drop wikileaks podesta dump weekend julian assange analyst Americans candidate press Democratic presidential candidate Hillary clintons unpopularity among American voters crack earths magnetic shield detected dna india worlds largest sensitive cosmic ray monitor located india recorded burst galact feds warn nyc qaeda attack york york city law enforcement authorities alert receiving warning feds amtv.
Alex Ansary,2016-11-04T22:44:06.026+02:00,amtvmedia.com,Fake,Feds warn nyc qaeda attack.,Behind Trump rally disturbance reno USA caused commotion Donald Trump rally hes registered Republican displeasure partys nominee members audience event gop presidential nominee tackled austyn crites reno yelled gun others trying rip away antitrump sign sign republicans Trump crites sign online held sign initially booing telling couple guys grabbing sign hands crites weapon secret service agents released effect charges agents whisked Trump offstage crites auditorium renosparks convention center crites holds ill secret service reno police job trying secret services attention respond michael newton santa rosa calif restrain crites didnt respond knee head guys moving immobilize final colorado push Trump urges supporters handdeliver ballots newton crites aggressor hand someones face crites didnt strike anyone ground mobbed multiple tackled kicking choking beating thats things crazier ground holding arms legs saying barely breathe turning neck air passing thats police intervened taking crites away handcuffs newtons partner Donald newton santa rosa immediate aftermath secret service investigation ongoing agency uses magnetometers presidential campaign sites making weapons smuggled events whats baffling crites anyone gun sign air wasnt making sudden movements wasnt noticed suspicious tackled crites thats case backs gop candidates voice frustration Trump cause panic rally fellow Americans theyre patriotic duty candidate showing Republican peoples brother slight difference crites connection campaign Democratic presidential nominee Hillary Clinton canvassed hours contributed campaign voted tonight classic example dictator incitement violence Republican brother stupid sign entire account afterward Trump supporters Clinton thughillary shill Trump assassin shortly incident rally Trump returned stage raucous applause thanking secret service launching prepared remarks campaign issued also thanking secret service supporters seth richardson setharichardson.
Alex Ansary,2016-11-05T00:33:12.210+02:00,amtvmedia.com,Fake,Bill Clinton Hillary lolita express pedophilia ring.,Hillary whore babylon human tracy twyman published larger subject isolate segments comprehensive subject relevant emerged FBI Hillary Clinton antichrist close whore babylon Hillary born supposedly hunch noticing clues david ickes forum speculated Hillary moonchild artist marjorie cameron implanted womb rocket scientist occultist crowley associate jack parsons ritual babalon working purpose birth incarnation crowley babalon scarlet whore cup blood foretold johns revelation rides beast cameron claimed fetus womb delivered involved militarys nuclear weapons progranm apparently cahoots parsons nuclear bomb tested fetus survived canister purpose trinity bomb canister jumbo supposed preserve plutonium bomb failed reportedly didnt using suggested preserved fetus moonchild presumably somebody crowley named female consorts always scarlet women hilarion jeanne foster crowleys attempt conceive heir magical hilarion resulted supposedly childs spirit attached protege charles stanfield jones attachment allegedly occurred jones ritual crossing abyss degree oto involves ritually sodomized everyone jack parsons willingly subjected ritual channeled book antichrist foretold years babalon scarlet hilarion manifest among fruition also believe Hillary notorious cracking voice rival Trump foretold document channeled parsons book babalon voice judgement Trump crack house though walls stone rule hell gates irons birth babalon rome hilaria festival goddess cybele worshipped black meteorite stone celebrate resurrection son legend states sex jealous others castrated die bleeding reason priests galli castrated women regretted caused life forced everyone rule celebrate laughing partying joyously commemorated festival notice Hillary Clinton laughing inappropriately also note Hillary Clinton selfdepricating jokes human shortcircuiting gets twisted lies buzzfeed noted sweating though odd Hillary notoriously Hillary deodorant clintons astounding guys realize human constructed garage palo alto mean nameless garage palo alto location stanford university jack parsons alma mater.
Alex Ansary,2016-11-07T02:09:02.970+02:00,amtvmedia.com,Fake,Behind Trump rally disturbance reno.,Military hackers claim penetration Russia sputnik military hackers penetrated russias electric grid telecommunications networks kremlins command systems making vulnerable attack secret American cyber weapons series reports television network nbc penetration series reports explaining efforts parallel claims also Russia China nations malware parts critical infrastructure penetration sides appears preparation allout war cyberspace nbc briefed intelligence official opportunity highly classified documents network downplayed prospect cyber war making leak intended warning adversaries nbc attempted explosive tuesdays presidential election citing concerns mischief Russian hackers armageddonlike scenario implied network explained electionrelated concerns cyber mischief involve releasing fake documents creating bogus accounts spread misinformation Obama administration public unconfirmed narrative hackers controlled Russian government stolen emails Democratic party headquarters private computer presidential candidate Hillary Clinton serving secretary state computers Clinton campaign chairman john podesta narrative Russia stole emails messages wikileaks flooded material daily basis leading tuesdays election Russia denied responsibility clintonrelated hacks links wikileaks Russian intelligence never substantiated reports United States indicate clintons private server official business tenure secretary state penetrated least foreign intelligence services emails proved embarrassing Clinton campaign disclosing decisions Clinton state department favored donors Clinton foundation payforplay schemes selling access influence activity appears coincide lucrative speaking engagements former president bill Clinton.
Alex Ansary,2016-11-07T02:09:03.024+02:00,amtvmedia.com,Fake,Hillary whore babylon human.,America brink civil war valerie jarrettbarack obamas closest consigliere lap luxury white houseis calling james comeys head FBI director reopened matter Hillary clintons emails days election comey digital missives clintons server discovered anthony weiners laptop nypd Obama uneasy jarretts hawkishness comey valerie argued comey interfering deliberately election process.
Alex Ansary,2016-11-07T20:01:08.261+02:00,amtvmedia.com,Fake,Military hackers claim penetration Russia.,Trump breaks stump speech admire beautiful Trump mask politico midway stump speech riff lamenting Hillary Clinton stage musicians jayz beyonce Donald Trump paused electioneve rally florida gawk attendees mask billy graham crusade looking thing looking greatness country looking religious liberty manhattan billionaire rubber Trump mask caught eye mask mask wow wow thats beautiful looks Trump podium seconds mask stage returned microphone held mask face examining closer held joked nice head hair ill tossing fun Trump rally crowd resuming remarks turning proposal stimulate job growth placing tariff companies production country sarasota florida rally Trump florida head events north carolina pennsylvania hampshire michigan joined final running mate indiana mike pence.
