author,published,site_url,label,title_without_stopwords,text_without_stopwords
Alex Ansary,2016-11-08T21:00:37.324+02:00,amtvmedia.com,Fake,Military prepares shut russias hacks election.,ISIS declared war palestine threatening genocide palestinian following murder hamas senior commander saber siam ISIS militants siam fact partner declared war religion muslims working heretical government gaza attack conducted isisaffiliated salafist rebels also warned local residents stay away hamas offices buildings plans attacks conflict hamas ISIS gaza palestinian forces demolished makeshift mosque ansar albayt almaqdis ansar albayt almaqdis egyptian islamist pledged allegiance ISIS recruiting palestinians islamic state demolishing almtahabin mosque hamas arrested men local salafist sheikh yasser abu houli ISIS claims palestinians knows names addresses officers working palestinian intelligence agency.
Barenakedislam,2016-10-27T00:12:35.588+03:00,barenakedislam.com,Fake,Muslim animal abuse palestinians film stoning hyena death using cement blocks stones.,Track boy hes foot brown hair wearing shirt lizard robot street performers weather nice son boardwalk street performers line pretzels chase pigeon crowd area couldnt anywhere robot streetperformer guys son loves boy lizard shirt guy robotically dancing funkytown matter implored dancing funkytown hed son refused character goddamn second extremely upsetting didnt dwell son robot street performer son thing pretend mode wouldnt eye begged boy starting worry son threw dollar tip bucket hoping didnt threw bucket didnt finally bucket whirred life blowing whirling whistle thing wouldnt son blowing stupid fucking whistle thats whistle point minutes since track son officially panic mode boardwalks robot street performers son guy studied moment elated unlike ones son mouth pretended robotically mouth ticket grabbed away son bitch hand metallic rose shit incorporating whole goddamn act crowd loving eating threw stupid metallic rose ground hed son robotic beatingheart thing mimes crying son motherfucker metallic handkerchief metallic fucking handkerchief swear god robot street performer smoking cigarette looking phone finally son boy character smoking cigarette robotically nightmare couldve comfort assistance approached robot street performer son dance battle tree guys couple statue men refused acknowledge statue men honestly shouldnt dancing whole thing supposed theyre statues dance whole dancing wouldnt second distraught mother disgusting robot performer son anywhere pointed robot finger boy row son described guy guy pointed boy robot dancing boy pointing boy loving attention infuriated fed robot street performers boy boy age running boy considering question robot streetperformer fucking shitwads boombox blasting funkytown suddenly everyone dancing funkytown boy thats finding robot street performers son daniel youre reading bike rental please.
Corbett,2016-11-01T19:29:20.309+02:00,corbettreport.com,Fake,Anthrax forgotten iraq war lie.,Window embed broc west joins ongoing asiapacific cover countries asiapacific inching American umbrella japanese russians verge formally concluding wwii peace treaty australia indonesias potential joint exercises south China sea notes.
Corbett,2016-11-03T17:50:59.009+02:00,corbettreport.com,Fake,Programmed hate,Window embed broc west joins ongoing asiapacific cover countries asiapacific inching American umbrella japanese russians verge formally concluding wwii peace treaty australia indonesias potential joint exercises south China sea notes.
Corbett,2016-11-04T19:14:01.967+02:00,corbettreport.com,Fake,Asiapacific perspective broc west.,Corbett FBI director james comey dropped political bombshell days presidential selection theories floated FBI director issued letter days national selection idea comey struggling internal insurrection agents disgruntled decision prosecute Clinton basis reality others idea comey agent russians working collusion Putin Trump kremlin puppet White House seemingly everyone missed regard letter issued days bombshell please access subscriber please members access content.
Corbett,2016-11-06T16:03:08.337+02:00,corbettreport.com,Fake,Japan Russia world war asiapacific perspective.,Window embed vote statistically meaningless sway selection vote strategically meaningless decides nothing future country vote selection rigged larken rose reminds matters voting immoral legitimizing system authoritarian control empowering oligarchs system control results selection.
Corbett,2016-11-06T21:38:49.637+02:00,corbettreport.com,Fake,Fbis surprise youre.,Window embed vote statistically meaningless sway selection vote strategically meaningless decides nothing future country vote selection rigged larken rose reminds matters voting immoral legitimizing system authoritarian control empowering oligarchs system control results notes conversation.
Corbett,2016-11-07T19:09:15.225+02:00,corbettreport.com,Fake,Larken rose immorality voting.,Douglas adams thanks fish scene spaceship lands earth robot emerges craft proclaiming peace exhorting earthlings lizard storys protagonist arthur dent request explained ford prefect experienced galactic hitchhiker comes ancient democracy mean comes world lizards ford rational coherent finally coffee forced nothing nothing anything straightforward world leaders lizards hate lizards lizards rule odd arthur democracy ford arthur hoping wasnt sounding ridiculously obtuse dont rid lizards honestly doesnt occur ford theyve vote assume government theyve voted less approximates government mean vote lizards ford shrug course arthur going didnt vote lizard ford lizard gin ford increasing air urgency creeping voice gin ill lizards ford shrugged lizards thing ever theyre course utterly someones joke verge contest least respected distrusted candidates office modern political history lizards thing ever solace years selection cycle corbett pointing since inception nothing stake presidential figureheads mere puppets fronts shadow government state commands controls military economic diplomatic machinery usled world empire oligarchs entire system chopping block years hoping public doesnt dreaded ballot box vote power dashing decades centuries carefully cultivated enslavement pencils touchscreens case anyone dislikes rhetorical questions answer dont word emma goldman shes reputed didnt voting changed anything theyd illegal mencken usual inimitable fashion quipped stateor matter concrete governmentconsists gang men taking talent business government talent getting holding office principal device groups pant pine cant promise times promise worth nothing tenth looting satisfy words government broker pillage election advance auction stolen goods lysander spooner principle majority rule minority practically resolves government mere contest bodies men masters slaves contest bloody nature things never finally refuses slave wendy mcelroy reminds voting act political freedom act political conformity refuse vote expressing silence screaming politicians ear represent process voice matters believe voting dead less effective bashing head wall vain attempt cure headache pathetic allowing oligarchs kitchen begging scrap food table evil immoral contemptible act slave internalized slavery thoroughly wants ensure everyone enslaved pointed yesterdays conversation larken rose spot vote doesnt matter change anything register protest believe since elections rigged votes arent counted inclined knock cast ballot sitting feeling done senseless meaningless immoral act least agree days productive interpret phrase productive youd allow humble suggestions join community organization freedom cell focus fostering economic connections ties geographical area join community currency community trading program community exchange foster agoristic connection others area commit spending spreading awareness banking oligarchy flag terrorism gmo crops subject strongly offline online using others starting community learn gardening canning appliance repair printing monetary theory subject handy event government collapse government doesnt collapse books less arguing online making friends local coffee shop learn skill teach else million things nothing whatsoever phony baloney political charade exemplified national selection ever tick box voting booth wins rigged sporting event believe lizards thing ever.
Corbett,2016-11-08T17:50:11.059+02:00,corbettreport.com,Fake,Larken rose immorality voting.,Window embed whatever whatever political divide times pass question emerge world hatred division divided ruled psychopaths warmongers world brings together world choice world.
Corbett,2016-11-09T11:03:50.778+02:00,corbettreport.com,Fake,Defeat world order.,Bread circuses phrase roman writer deplore declining heroism romans roman republic ceased exist roman empire began things anxiously desire bread circuses government roman populace distributing food staging huge spectacles selection circuses worry food distribution increases.
Corbett,2016-11-10T11:24:44.902+02:00,corbettreport.com,Fake,World james evan pilato.,Window embed pledge newsbud kickstarter  spiro skouras joins operations discuss reporters programs changes accomplished since funding drive theyre hoping achieve latest funding drive.
Corbett,2016-11-11T17:49:12.253+02:00,corbettreport.com,Fake,Newsbud launches phase funding drive.,Corbett voting machines puppet figurehead pax americana state years circus peanut shells swept stands well notsogood lets apparently voted Trump belief antiestablishment truthtelling hero working class hate disabuse notion lets transition campaign tapped administration contacted potential appointments warning access please access subscriber please members access content.
Corbett,2016-11-11T17:49:13.736+02:00,corbettreport.com,Fake,Selection world,Election Clinton continues lawless agitation intimidation violence streets demonstrating reasonable everywhere Americans choice thank msm soros showing everyone Democratic hearted globalist world order Hillary election rules candidates vote order elected Trump campaigned vigorously cities also contest landslide landslide considering supported Trump mainly voted jobs core values constitutional misguided globalism imposed essentially voting nation establishment systematically outsourcing everything matters despite stakes essentially principled adhering electoral rules fair lawful Democratic change Clinton hand devoid principles interests election Clinton intimidation tactics agitators cheated swelling voters lists opening border signing droves illegal immigrants voter fraud rigged voting machines acceptable supported biased corrupt lying mainstream effect pervasive Trump supporters ridiculed shunned views dishonest illegal oppressive tactics Clinton Trump vote greater circumstances Clinton loss embarrassing party msm paul formby.
Corbett,2016-11-14T23:13:00.000+02:00,corbettreport.com,Fake,Notmypresident clintonpledge.,Window embed revolution well dont worry happening nothing whatsoever political game ruling oligarchs entice years radical decentralization transforms economy finance manufacturing question whether youre taking revolution happening televised notes.
Corbett,2016-11-17T20:39:13.088+02:00,corbettreport.com,Fake,Infamous minutes soros emerges online.,Corbett government giveth government taketh away money wallet india word havent case missed din clatter selection circus hell loose india indian prime minister narendra modi surprise television address nation guessed stale speech modi shockwaves country region announcing midnight existing rupee notes longer accepted legal tender tax cattle trade rupee notes offices banks bits colored paper everyones wallets aswell bits colored paper access please access subscriber please members access content.
Corbett,2016-11-19T22:09:45.115+02:00,corbettreport.com,Fake,Crisitunity indias cash crunch.,Film literature world order james joined prof history explore james ellroys American tabloid novel fictional cuban stooges embroiled yearslong mess ends assassination president plausible scenario documentaries books subject thats edition flnwo limited bandwidth smaller lower size episode interested quality highestquality episode warning notes.
Corbett,2016-11-21T21:40:00.000+02:00,corbettreport.com,Fake,James ellroys American tabloid flnwo.,Window embed james talks nomi prins author books presidents bankers central bank power shift west east game thrones style talk changing economic monetary landscape locus central bank power shifting east players peoples bank China gaining prominence former useu lapdogs imf becoming brokers power players world financial order notes.
Corbett,2016-11-21T15:53:00.000+02:00,corbettreport.com,Fake,Newsbud roundtable elections reality.,Corbett film literature world order james joined prof history explore james ellroys American tabloid novel fictional cuban stooges embroiled yearslong mess ends assassination president plausible scenario documentaries books subject thats edition flnwo notes.
Corbett,2016-11-22T17:27:38.218+02:00,corbettreport.com,Fake,Nomi prins explains central bankers game thrones.,Window embed reddit banned pizzagate subredditbut investigation continues pizzagate forum sprung voatco awareness scandal spreading outlets corbett community collate pizzagate scandal.
