author,published,site_url,label,title_without_stopwords,text_without_stopwords
Sean Colarossi,2016-10-28T04:10:02.350+03:00,politicususa.com,Real,Days Trump campaign.,Hrafnkell haraldsson cant waterboarding tough fighting level toughand cases vicious Donald Trump complains spending fortune war east supported war Republican administration knowingly lied facts Trump also lying facts least brings countrys east ordeal fullcircle Trump speaking rally mexico youve doubt barrage commercials repeating lie Hillary disaster iraq syria libya touches empowered Iran unleashed ISIS leaving vacuum course Republican president george bush negotiated balance forces agreement iraq stipulating America draw combat strength reneging agreement meant peace iraq negation ISIS second invasion rise ISIS peace strength Trump crowd dont wars savages chopping heads well fact war invaded iraq vice versa Trump drowning steel cages burying sand havent medieval times medieval times cant waterboarding tough fighting level fighting level folks tough smart cases vicious honest vicious building country country weve trillion east trillion couldve rebuilt country twice never mind moment torture illegal international law never mind Senate intelligence committees torture doesnt trumps argument sounds wanting aggrieved Trump wanting spite enemies international scale arguing boot justifies means doesnt cant prove acting barbarians doesnt barbarians cant prove Senate torturing war claim million Trump charlotte well politifact ruled half saying Trump citing highend estimate credible analyses spending associated wars iraq afghanistan confusing money thats money researchers point war begun Obama Hillary Clinton least admits supported apologized Trump deny ever despite facts contrary Trump vicious also saying dishonest nobody lies success rate Donald Trump Trump loves war unpredictable cant nuclear weapons since national security experts nuclear football hands matter claims world works promoting torture fulfilling wildest propaganda wishes islamic state promising precisely.
Sean Colarossi,2016-10-28T05:12:12.375+03:00,politicususa.com,Real,Senator mark kirk mocks disabled veteran tammy duckworth mixedrace heritage.,Surprise aimed opponent flops polls propaganda losing Trump campaigns latest hail mary fool voters ditch propaganda push recruiting volunteers blitz talk radio talking points monitor discussions callers talk host editorinchief charlie sykes welp Trump campaign planning talk radio blitz recruiting volunteers shows talking points charlie sykes sykescharlie Trump campaigns action Trump talk radio blitz Donald Trump elected please sign volunteer talk radio final days presidential campaign wisconsins voters Donald Trump looking volunteers sign Trump talk radio blitz captain andor Trump talk radio blitz caller thank willingness elect Donald Trump mike pence election captains monitor discussions talking points propaganda willing check apply willing serve Trump talk radio blitz captain taking responsibility monitor recruit callers talk radio programs election willing Trump talk radio blitz caller select minute segments local talk radio shows Donald trumps campaign captains charge entire shows Trump message gets monitor discussions lest anyone facts air captains sign responsible entire talk radio program programs election recruit callers Donald trumps campaign program remind Trump talk radio blitz callers sign commitment ensure Trump talk radio blitz callers prepared discuss shows topics monitor discussions successes campaign Trump campaign mean working well Trump spokespeople propaganda artists embedded cable network organize nonprofessionals talking points disseminate appears organic lol kid youve section forums campaign message screaming siren talking points screaming tinfoil fake polls accusations Hillary Clinton committed treason though cleared neednt worry entire country gone insane gasp sinking campaign trying fool voters propaganda dished volunteers.
Hrafnkell Haraldsson,2016-10-28T16:28:39.022+03:00,politicususa.com,Real,Banishment Trump begun American tuning.,Hrafnkell haraldsson mon oct Trump refused produce records sought prosecutors months oath destroying whole newsweek kurt eichenwald struck reporting Donald Trump refused produce records sought prosecutors months oath destroying whole whole strategy writes newsweek swears comeys announcement deny impede delay destroying documents court ordered hand reveals Republican nominee father estate company battled federal government civil charges refused rent apartments africanamericans shortly government filed case Trump attacked falsely declared reporters feds evidence father discriminated minorities attempting force lease welfare recipients couldnt rentthe familys attempts federal case times nonsensical Trump submitted affidavit contending government engaged unspecified wrongdoing releasing statements press case formal communications contended hed learned complaint listening car radio trumps sworn lie court records government filed complaint phoned immediately afterward government notified press release months original filing case nowhere trumps repeatedly ignored deadlines produce records answers questions subpoena Trump deposition missing documents shocking admission trumps destroying corporate records months documentretention program conducted inspections determine files sought discovery requests case order space Trump testified company tossing documents shredder garbage Trump accuse Hillary Clinton destroying emails means covering deflecting misdeeds regard affidavits deny delay strategies writes eichenwald Trump cos hid destroyed records sought court Donald Trump world class liar deflection tactics projecting guilt others foundation trouble point finger Clinton foundation sexual assault allegations point finger bill Hillary Clinton kurt eichenwald dug Donald trumps deplorable Donald Trump revelation eichenwald david fahrenthold shows Trump human wonder deplorables turns Trump investigators months destroyed emails hrafnkell haraldsson mon oct.
Hrafnkell Haraldsson,2016-10-28T16:28:39.960+03:00,politicususa.com,Real,Billionaire Donald trumps presidential campaign flat.,Ethics complaint filed jason chaffetz releasing letter FBI director james comey Democratic coalition Trump complaint Democratic coalition Trump filed complaint jason chaffetz office congressional ethics role releasing FBI director james comey chaffetz illplanned partisan attempt released compromised integrity FBI irresponsibly tweeted case investigating secretary clintons emails reopened fact members Congress elected country safer power leaders comey partisan fashion held accountable actions scott dworkin senior advisor Democratic coalition Trump director comey facing complaint filed department justic accusing violating hatch act using position federal employee influence outcome election comey letter couldnt gone republicans gop originally election shifting moment Republican scandal democrats strongly suggesting inspiring hearings Senate majority thanks chaffetz house republicans credibility future Clinton investigations utah republicans spin comeys letter debunked matter hours gone order republicans comey chaffetz facing complaints Hillary Clinton remains course elected president United States.
Jason Easley,2016-10-28T18:10:27.176+03:00,politicususa.com,Real,Moronic Trump campaign thinks reopened Clinton investigation.,Sean colarossi mon oct cnn obtained north carolina gop senator richard burr joking gun owners putting bullseye Hillary Clinton cnn obtained brand north carolina Republican senator richard burr joking gun owners putting bullseye Hillary Clinton despicable burr faces close Senate race Democratic opponent deborah ross candidates point realclearpolitics cnn north carolina Republican locked tight race reelection quipped gun shop nothing seeing magazine rifles Hillary Clinton shocked didnt bullseye gop volunteers prompting laughter crowd mooresville north carolina magazine everybody federal office state vote assure theres army candidates rhetoric hardly uncommon comes Republican leaders campaign gone hateful violent rhetoric Republican ticket increasingly point Donald Trump suggested second amendment arms Clinton nominates supreme court justices dont also hed happens Democratic nominees bodyguards disarmed cnn notes Trump never issued genuine apology language anything hes ever done burr quickly although excuse inappropriate apologize Republican senator cnn.
Jason Easley,2016-10-28T18:10:28.433+03:00,politicususa.com,Real,Reopening Clinton investigation gop hype nothing.,Jason easley mon oct painting CIA director james comey office influence presidential election comey letter Hillary clintons emails refused Russia meddling election hacking democrats painting CIA director james comey office influence presidential election comey letter Hillary clintons emails refused Russia meddling election hacking democrats cnbc FBI director james comey argued privately close election United States government Russia meddling election ultimately ensured fbis document government former FBI official tells cnbc former official comey agreed conclusion intelligence community foreign power trying undermine election believed putting election comeys position official shouldnt FBI youll recall director comey didnt interfere presidential election releasing harm Republican presidential nominee Donald Trump qualms sending letter Congress emails never apparent effort interfere current presidential election revelation detail becoming conclusion FBI director comey violated hatch act letter Congress illegal federal employees positions interfere elections Donald Trump comey argued publicly released close election embraced standard less frame damage Hillary clintons campaign becoming comey abused power removed FBI director immediately.
Jason Easley,2016-10-28T20:53:11.791+03:00,politicususa.com,Real,Hillary Clinton brilliantly forcing Trump money defending arizona.,Washington Donald trumps hiring pollster tony fabrizio viewed sign estate mogul finally bringing seasoned operatives insurgent operation Republican presidential nominee appears issue services veteran gop strategist advised candidates gop nominee bob dole florida rick scott Trump campaigns latest federal election commission shows disputing fabrizios firm owed polling trumps decision pollster trumps history paying services performed wont astonishing party supposed fiscal responsibility conservativism forward presidential nominee career running debt personal gain Donald trumps mentality always paying debts never seems priority Trump businesses stiffing vendors contractors decades isnt surprising mentality presidential campaign anybody works Trump campaign smart Donald trumps making America great involves taking money putting pocket Trump deadbeating campaign debts refusing pollster jason easley mon oct.
Jason Easley,2016-10-28T20:53:13.796+03:00,politicususa.com,Real,Marco rubio inches closer unemployment poll shows florida Senate race tie.,Hillary Clinton supporting priorities USA super pac released powerful makes closing argument women vote Democratic nominee carole king classic natural sung daughter features clips ordinary women living mixed clips elinor roosevelt rosa parks sally ride Hillary Clinton twothirds Trump appears calling women fat pigs slobs fat asses flat chested among insults screen shots women holding cards hashtag vote message powerful devastating women vote behavior Donald Trump words Donald Trump treatment women rejected Americans conscience realistic society women women moral voice rejects Trump polling women Hillary Clinton presidential cnn Trump campaign request silence Donald trumps words talking voters.
Jason Easley,2016-10-28T20:53:16.992+03:00,politicususa.com,Real,Mike pence fine Trump sexual assault offended voter suppression.,Sean colarossi mon oct continues focus Clinton nonstory Donald trumps ties Russia continues gain steam continues focus increasingly becoming nonstory FBI director james comeys vague letter emails Hillary Clinton Donald trumps ties Russia continues gain steam nbc FBI preliminary stages investigating trumps excampaign managers connection Russia slate also Trump server repeatedly communicating Russian bank slate claims computer scientists looking Russian cyber attack dnc stumbled unexpectedly scientistswho referred tea leaves pseudonym protect relationship networks banks employ sift datafound malware emanating Russia destination domain Trump course attracted tea leaves attention discovery data pure happenstancea surprising needle haystack dns lookups screen outlier connects Russia notes couldnt figure bank moscow irregularly pinging server registered Trump organization fifth avenue data began carefully keeping logs Trump servers dns activity collected logs circulate periodic batches colleagues cybersecurity world began scrutinizing clues researchers quickly dismissed initial fear logs represented malware attack communication wasnt bots irregular pattern server lookups resembled pattern human began office hours york office hours moscow dawned researchers wasnt attack sustained relationship server registered Trump organization servers registered entity alfa bank doesnt nowhere Trump repeatedly praised vladimir Putin leader taking prorussia positions campaign straight kremlin wishlist Clinton campaign jump Clinton senior adviser jake sullivan secret hotline key unlocking mystery trumps ties Russia seems Trump organization hide apparently steps conceal discovered journalists line communication explain trumps bizarre adoration vladimir Putin endorsement prokremlin positions campaign raises troubling questions russias masterminding hacking efforts intended hurt Hillary clintons campaign assume federal authorities explore direct connection Trump Russia existing probe russias meddling elections trumps prorussia rhetoric positions coincidence comes clearer Republican nominee connections Russia hiding voters election explosive focusing critical American financial ties potential president American adversary adversary Russia.
Jason Easley,2016-10-28T20:53:25.708+03:00,politicususa.com,Real,Revived Clinton scandal slew facts record.,Sean colarossi mon oct Trump tax avoidance maneuver legally dubious lawyers advised internal revenue service declare improper audited Donald Trump repeatedly advantage loopholes allowed legally nothing federal income taxes decades york times Trump crossed legal boundary avoid paying fair times Republican nominee tax avoidance maneuver legally dubious lawyers advised internal revenue service declare improper audited tax experts newly obtained documents york times trumps tax avoidance maneuver conjured ambiguous provisions highly technical tax court rulings pushed edge envelope tax laws permitted whatever loophole existed exploited stretched recognition steven rosenthal senior fellow nonpartisan tax center draft tax legislation tax experts maneuver trampled core American tax conferring enormous tax benefits Trump losing vast amounts peoples money case money investors banks entrusted casino empire atlantic city reason Trump bent backward potentially laws avoid paying taxes scrambling stave financial ruin claims great president successful business background calls king debt businesses declared bankruptcy times decades paying zero dollars federal income taxes billion dollars single running casino business reporting tonight suggests direct financial ties Russia tip iceberg comes business background American voters Donald trumps finances refused transparent Trump hiding tax returns damning keeps coming reporting werent released latest york times latest installment trumps shady business background remaining campaign demanding answers wants charge countrys pocketbook.
Sarah Jones,2016-10-28T20:53:25.711+03:00,politicususa.com,Real,Reality slaps Donald Trump face economy roars.,Sarah jones tue nov United States district court jersey ordered discovery Donald Trump rncs poll monitoring efforts hearing days election republicans ordered explain monitoring polls voter fraud United States district court jersey ordered discovery Donald Trump rncs poll monitoring efforts hearing days election order demands affidavits parties personal knowledge defendants rncs efforts Trump campaign monitor precincts country indicated kellyanne conway affidavits also demanded Republican operatives states conducting state voter fraud monitoring poll monitoring rnc rob gleasons efforts recruit persons act poll watchers philadelphia pennsylvania rnc ronna romney mcdaniels efforts michigan prepare massive statewide antivoter fraud effort rnc also answer governor mike pences Trump campaign working state governments secretaries state ensure ballot integrity happens zero regard election law vigilante rick hasen election law noted discovery granted broad broad discovery order hearing judge rejected discovery sought dnc frame alone educational efforts going behind scenes dnc filed lawsuit Republican national committee violating court order intended prevent voter intimidation Donald trumps claims election rigged supporters polls intimidate voters Donald trumps urging supporters polling places often urban areas voters violation consent decree court isnt discovery courtordered republicans facing uphill battle bid White House exceptionally unpatriotic intimidate fellow citizens exercising vote everyone vote intimidation dont anyone dissuade voting court ruling.
Jason Easley,2016-10-28T22:03:39.478+03:00,politicususa.com,Real,Trump wrecks gop taking advantage Clinton investigation.,Hrafnkell haraldsson tue nov springnew york legal action collect unpaid taxes trumpowned company owns trademark boeing kurt eichenwalds revelation Donald Trump investigators months busily destroying emails hardly trumps misdeed realize Donald Trump moment seventyfive legal issues hanging head hes lying times less excuse mainstream thoroughly distracted Clinton nonstory divert attention away legally questionable activities USA weeks election least plus lawsuits involving Trump businesses ongoing nationwide state federal court records USA surprise Trump deadbeating pollster Trump case nonpayment tips caterers Trump soho hotel york city scheduled election thing election Trump bills covered incident declined finish paying florida contractor resorts contractor though wasnt agreedupon Trump nailed court attorneys fees case examples USA todays investigation Trump faces litigation tied businesses members jupiter fla golf course cheated refunds dues former employee club claims fired reporting sexual harassment theres fraud case Trump university students moguls company ripped tens thousands tuition sham estate course Trump also defending lawsuits tied campaign disgruntled gop political consultant sued million saying Trump defamed suit class action campaign violated consumer protection laws sending unsolicited text messages pointed USA todays nick penzenstadler john kelly lawsuits dog Trump White House immunity president America world treated spectacle president United States trip trip court settle highly questionable personal business affairs harassment cases sex discrimination lawsuits fraud unpaid bills racist defamation cases involving Trump university USA notes springnew york legal action collect unpaid taxes trumpowned company owns trademark boeing jetted mogul campaign rallies country cases Trump promised sue york times women nymag maintains exhaustive list accused sexual assault USA months researching court records unprecedented mountain legal battles presidential candidate ranging skirmishes pageant contestants multimillion dollar estate lawsuits cases clues leadership style billionaire White House Donald Trump claims Clinton tainted claims clintons emails bigger watergate tweeted crookedhillary criminal scheme oval office draintheswamp comes pennsylvania avenue morality nogo zone facts disclosures trumps ties Russian server potentially illegal ploy avoid paying taxes Trump deadbeat liar drains swamp drain.
Sarah Jones,2016-10-28T22:03:40.113+03:00,politicususa.com,Real,Gop scandal falls apart emails didnt Hillary clintons server.,Rmuse voter suppression tactic gop election rigging playbook suppress black vote north carolina following column muse Americans aware psychological term projecting means attributes faults actions else unconscious transferring guilt ones actions Republican primaries concluded Donald Trump projected republicans guilt election rigging vote obstruction suppression democrats opponent Hillary Clinton republicans actively suppressing votes since election barack Obama ramped election rigging activities years Trump accuses democrats election rigging frequently human beings draw breath north carolina conference national association advancement colored naacp filed lawsuit north carolina republicans demanded immediate coordinated effort suppress black vote state naacp rightly voter suppression tactic gop election rigging playbook suppress black vote state election rigging amounts counties north carolina canceling voter registration thousands mostly african American Democratic residents presidential election lawsuit charged election beaufort moore cumberland counties denying primarily african American voters eligibility participate democracy voter registration documents mysteriously bounced undeliverable voters eligibility vote denied flagged purging james edward arthur county legally allowed cast ballots purged voters original registration address victims postal service error arthur african American nursing voted least elections county born raised issue arthur testified thousands african American Democratic voters never state county election documents informing eligibility denied didnt attend appeal hearing maintain vote denied participate democracy arthur vote jeopardy whatever protect plan vote upcoming election concerned since registration canceled able cast ballot counted sane human election rigging simply tricounty ploy targeted primarily african Americans vote democrats also north carolina republicans guilty years naacp lawsuit north carolina republicans violation national voter registration act bans systemic removal voters rolls final days election Republican election state defended election rigging justified purging tensofthousands mainly african American Democratic voters eligibility definition systemic individual basis naacp also accused republicans conducting coordinated mailing campaign sole purpose challenging eligibility thousands mainly african American voters eligibility mailing Republican local office shane hubers challenged registration voters majority democrats beaufort county counties charged lawsuit cumberland county individual returned mail challenge registrations mostly Democratic voters moore county secretary local Republican party carol wheeldon challenged mainly african American registered voters vote republicans attorney naacps lawsuit penda hair although cannot prove concerted Republican election rigging conspiracy counties challenges connections local Republican party also pattern challenges counties hair also noted moore county return address rightwing voter integrity project mail challenge voters pernicious treatment voters also deliberate act election rigging republicans president north carolina naacp reverend william barber seeing attempts voter suppression north carolina weve since days jim crow tar heel state ground zero intentional surgical efforts suppress voice voters attempts direct affront constitution naacp lawsuit demanding state reinstate voters challenged since using election rigging process rolls immediately organization also demands state notifies voters reinstated eligible voters allow cast regular ballots election request emergency hearing case case naacps request hearing granted charges arising days federal court ruled north carolina republicans violated national voter registration act manner failing tens thousands voters rolls registered dmv office years district court judge loretta biggs ordered north carolina republicans permit tensofthousands voters cast provisional ballots highly doubtful north carolina republicans obey federal judges orders recipients court orders election rigging actions effect whatsoever republicans disenfranchising voters republicans tear rig elections since American elected barack Obama president conservatives supreme court ultimately guilty conspiring republicans suppress obstruct voting primarily color dont republicans perfectly irrelevant voter suppression obstruction disenfranchisement deliberate attempt rig elections republicans koch brothers outfit American legislative exchange council alec behind attempt republicancontrolled states democracy Republican party standard bearer Donald Trump guilty projecting rig elections.
