author,published,site_url,label,title_without_stopwords,text_without_stopwords
Alex Ansary,2016-11-07T20:01:08.418+02:00,amtvmedia.com,Fake,America brink civil war.,Donald Trump kicks final campaign fla rally boston globe Donald Trump criticizing fbis decision criminally charge Hillary Clinton American deliver justice ballot box Trump kicked election eve blitz rally florida sarasota crowd system rigged least claimed country laughing stock world Republican nominee pantomimed quotation marks word justice hit FBI department justice handling case FBI director james comey notified Congress emails connected clintons servers produce evidence warrant charges exaide former president bill Clinton alleged hacked chelsea Clinton familys charitable foundation underwrite wedding exchange doug band Hillary Clinton campaign chairman john podesta released wikileaks organization stolen messages chronicled tensions Clinton foundation band daughter Democratic presidential nominee band podesta chelsea Clinton gossiping outsiders investigating questionable spending band suggested scrutinized using foundation resources wedding Clinton foundation immediately respond request band forced amid issues consulting firm ___ Donald Trump kicking breakneck campaigning polls rally sarasota florida Trump telling thousands supporters packed local fairgrounds arena election hands mean thing Trump planning frenzied campaign pace rallies states north carolina pennsylvania hampshire michigan Trump also continuing paint rival Hillary Clinton corrupt alluding scrutiny private sever secretary state Trump also fun point held mask likeness complimented hair ___ White House defend criticize FBI director james comeys decision letter Congress Hillary clintons emails thats phrasing White House comey initially FBI looking emails investigation Clinton followup letter comey FBI completed standing recommendation charges filed White House josh earnest reporters aboard air force White House hasnt briefed investigation didnt advance notice comeys latest letter earnest Obama confidence comey ___ philadelphias public transit system running election weeklong strike ended thats relief states democrats Democratic city strike affect turnout polls pennsylvania voting election turnout key state favored democrats presidential elections polls suggest race tightening Democrat Hillary Clinton counting philadelphia area candidates campaigning state southeastern pennsylvania transportation authority union representing transit workers tentative agreement subways operating reduced schedule limited trolled serve restored ___ justice department staffers states election monitor polls thats percent reduction years department personnel jurisdictions potential civil violations mondays announcement comes amid rising concerns voter intimidation aimed minorities personnel less monitors observers dispatched justice department pollwatching presence curtailed supreme court gutted key provision voting act attorney general loretta lynch department committed ensuring eligible voter participate election ___ Hillary Clinton departing multistop swing presidential battleground states election shes telling reporters going vote counted Clinton thinks country together wants president vote dont speaking reporters airport york city Clinton agenda ahead vowing done defeats Republican Donald Trump Democratic presidential nominee campaigning pittsburgh grand rapids michigan philadelphia raleigh north carolina ___ jersey chris christie doesnt george Washington bridge lane closure controversy cost vice presidential nomination christie cbs runnerup Republican Donald trumps vice presidential denied Trump job rescinded thinks Trump indian governor mike pence choice christies former allies convicted role realigning access lanes bridge political revenge plot Democratic mayor didnt endorse christie thinks Trump defeat Democrat Hillary Clinton momentum country wants change ___ ohio democrats supreme court intervene voter intimidation lawsuit swing state party filed emergency request nations court lift cincinnatibased federal appeals court order ruling granted Donald Trump campaigns request block federal judges restraining order democrats prevent voter intimidation circuit court appeals threejudge panel ohio democrats didnt likelihood success cases merits party supreme court appellate judges ruled ing critical evidence lower court judge relied ruling anyone engaging intimidation harassment polling places face contempt court charges ___ Donald trumps campaign manager staff tweeting Trump exhibited restraint final days campaign york times aides finally wrested away account president barack Obama seized voter rally florida telling crowd anyone cant trusted account shouldnt trusted control americas nuclear weapons times nbcs campaign manager kellyanne conway ___ cloud FBI investigation lifted Hillary Clinton Donald Trump struck strikingly tones final hours volatile twoyearlong presidential campaign days attacks trumps qualifications temperament Clinton cast candidate healing reconciliation surprising position divisive figures American politics Trump voiced confidence campaign visions rigged American economic political system longtime Democratic strongholds overshadowing flurry lastminute campaigning FBI director james comeys latest letter Congress informing lawmakers bureau evidence hurried newly discovered emails warrant criminal charges Clinton.
Alex Ansary,2016-11-07T20:01:08.529+02:00,amtvmedia.com,Fake,Trump breaks stump speech admire beautiful Trump mask.,Kremlin nato agression Russia reports reinforcement nato troops close russias borders aggressive character organization kremlin commenting preparations deter alleged Russian threat western military alliance established peacebuilding aggressive actions kremlin dmitry peskov despite fact blocs opposed nato longer exist change alliances aggressive nature ideological political bases times published suggesting hundreds thousands nato troops higher state alert amid growing tensions Russia british daily cites alliances secretarygeneral jens stoltenberg uks outgoing permanent bloc adam thomson nato aims largely speed troops deployed reportedly aims military personnel nations alliance shortened response months compared current days responding biggest reinforcement collective defense since war stoltenberg times bloc looking million personnel shorter notice saying nato defense ministers discussions issue accused moscow assertive behavior nato chief Russia increased defense spending developing military capabilities regard national security Russia acts national borders undoubtedly posing threat anyone peskov commenting stoltenbergs statements military bloc reacted shows organizations aggressive nature.
Alex Ansary,2016-11-07T20:01:08.682+02:00,amtvmedia.com,Fake,Donald Trump kicks final campaign fla rally.,Hillary Clinton election press Democratic presidential nominee Hillary Clinton leads Republican rival percentage points nationally head final tight race White House poll final bloomberg politicsselzer poll released Clinton ahead Trump percent percent libertarian candidate gary johnson percent green party candidate jill stein percent Clinton also leads Trump points hypothetical twoway matchup thirdparty candidates tracking poll released also Clinton former secretary state held fourpoint billionaire businessman latest abc newswashington poll survey percent voters backed Clinton percent supported Trump Clinton campaign FBI director james comey announcing criminal charges forthcoming probe clintons newlyfound emails changed conclusions expressed FBI chief letter congressional committee chairmen development relief Clinton spending final hours campaign trying close trumps path presidency Donald Trump walks stage holding rally loudoun fairgrounds leesburg virginia.
Alex Ansary,2016-11-07T20:01:08.718+02:00,amtvmedia.com,Fake,Kremlin nato agression.,Reno female attorney general dies npr reno serve attorney general United States died complications parkinsons disease renos goddaughter gabrielle dalemberte sister margaret hurchalla passing npr reno final days miami surrounded friends dalemberte associated press reno served longer job anyone years tenure marked tragedy controversy office widely respected independence accomplishments president bill clintons choice head justice department second confirmation flames second choice also proved controversial Clinton finally reno unexpected connections Clinton Washington Clinton reno bigtime prosecutor holding prosecutors job miamidade county position elected times years jamie gorelick deputy attorney general assigned prep reno confirmation hearing least airbrushed candidate ever cabinetlevel position gorelick didnt change Washington reno arrived justice department knowing immediately plunged siege branch davidian compound waco texas federal agents wounded serving warrant illegal guns weeks siege pressed FBI reno authorized raid compound resulting deaths davidian leader david koresh ordered fire compound sets waco congressional hearings years reno successfully quell critics haunted reno explained hearing sitting days koresh explosives blew agents entire years npr shortly leaving office regret palpable well never whether mistake sense reno admitted knowing figure waco didnt hesitant insistent getting observes walter dellinger served justice department jobs reno dellinger believes instance waco experience reno personally miami avoid forcible removal yearold cuban refugee elia gonza lez greatuncle boy returned living parent cuba elia rescued sea mother others drowned trying United States rescued fishermen greatuncle cuban community miami uproar idea returning boy father cuba furor bled Congress negotiations greatuncle failed armed federal agents acting renos orders raided removed elia father son supreme court refused intervene returned cuba reno takes oath attorney general ceremony White House president bill Clinton watches barry thummaap course reno embroiled controversies sought appointment series independent counsels investigate fellow members president Clinton refused authorize independent counsel investigation contributions clintongore campaign justice department lawyers concluded crime committed president vice president decision infuriated republicans impeachment politicized justice department history United States railed dan burton Republican chairman key house oversight committee feet inches reno tall political crosswinds gorelick observes members Congress burton unhappy government official threatened official testify reno served staffer florida state legislature always fine ill result gorelick eventually threatening hearing prevailed outing recall laid views bested challenge controversies justice department faced renos reign often eclipsed things well apprehension successful prosecution oklahoma city bombers example pursuit bombers womens health clinics abortions solving socalled unabomber case decades fruitless pursuit FBI idea identity dubbed unabomber injured bomber letter york times offering cease terror campaign times Washington publish word manifesto modern industry technology newspaper inclined initially reno daughter newspaper journalists persuaded newspaper owners jointly publish essay interests public safety unabombers brother recognized style ideas essay tipped FBI ending bombers reign terror theodore kaczynski aka unabomber serving life term maximum security federal prison reno diagnosed parkinsons disease hands shook knocking table congressional hearing joked disease claiming shaking helps playing steel drum balancing kayak combination toughness selfdeprecating humor plus determination protect justice department improper influence hero reno values former deputy attorney general gorelick departments official meant path thing believed charge hill behind never florida gubernatorial candidate former attorney general reno speaks florida Democratic party state conference lake buena vista fla Democratic primary reno enormous respect department well ethic dedication understanding issues parts justice department national security environmental questions obscure field indian law attorney general loretta lynch effective decisive wellrespectedleaders departments proud history never shied criticism shirked responsibility former attorney general eric holder city compromise values term political gain reno integrity enduring values former solicitor general dellinger believes reno prepared attorney generals job life intellect ungainly height cornell harvard law school women harvard law school junior school twice tall anybody else twice smart thats tough course ups downs years renos reign always job brings wont difference brings angels saying wont difference npr president Clinton secret frequent displeasure reno wall separation erected justice department White House never resign reno reappointed reelection wonderful dellinger stay turns nobody fire tension Clinton attorney general apparent clintons office drew close cbs minutes Clinton praise friends foes alike evaluation reno tepid least job shes least didnt replied reno laugh ill tenure reno outlasted critics earned reputation integrity independence comedian ferrells parody iconic skits nbcs recurring skit inspired reports reno figure dancing justice department party episode renos dance party parody ferrell wearing blue dress pearls reminisces glories laments party suddenly reno comes crashing wall wearing blue dress pearls ferrell deliver ferrells signature lines reno reno mourns skits dance reno commanding orchestra hit breaks moves twist shout office.
Alex Ansary,2016-11-07T20:01:08.775+02:00,amtvmedia.com,Fake,Hillary Clinton election.,Quake oklahoma oil hub causes substantial damage cbs magnitude earthquake centered worlds key oil hubs building facades shattered windows central oklahoma city rendering centuryold buildings unsafe raising concerns key infrastructure sun rose television footage widespread substantial damage buildings piles bricks debris littering ground following earthquake cushing assistant city manager jeremy frazier conference injuries damage contained downtown oklahoma thousands earthquakes years traced underground injection wastewater oil gas production sundays quake centered mile west cushing miles south magnitude quake forced shutdown wells fearing aftershocks police cordoned older parts city gawkers away geologists quakes rumbled area frazier assisted living community evacuated damage cushing public school district canceled classes stay area city manager steve spears noted damage superficial compromised foundations potential problems assess daylight city miles northeast oklahoma city oklahoma department transportation highway bridge damage mile radius earthquakes epicenter quake struck away iowa illinois texas geological survey initially sundays quake magnitude lowered reading whole trailer going tip shaking cushing resident cindy roe lights things falling ground awful dont cushings oil storage terminal worlds largest oct tank farms countryside cushing held million barrels crude oil data energy administration community bills pipeline crossroads world frazier pipeline companies trouble community hadnt companies mary fallin tweeted damage storage tanks cushings oil storage terminal megan gustafson jonathan gillespie working cushing mcdonalds quake hit train going building gustafson coworkers behind police barricade downtown looking damage freaked hyperventilating gillespie building shook seconds wasnt alarmed gustafson area experienced multiple earthquakes years didnt anything usgs data dozen earthquakes oklahoma quakes hit oklahoma corporation commission directs well operators cease wastewater injections reduce volume earthquake record oklahoma hit pawnee sept shortly afterward geologists speculated whether temblor occurred previously unknown fault office whole house sway spears cushing city manager.
Alex Ansary,2016-11-07T20:01:08.838+02:00,amtvmedia.com,Fake,Reno female attorney general dies.,Las vegas amsterdam times nevada legal brothels roundtheclock casinos coy catchphrase declaring happens vegas stays vegas voters approve state vice recreational marijuana proposal nov state ballot legalize pot entrepreneurs passage someday allow drug las vegas glamorous nightclubs framework future amsterdamstyle cannabis district thirdlargest market country derek peterson company operates medical marijuana dispensaries blum predicts california york bigger customer base las vegas million tourists able fit well whole dayclubnightclub thing nevada allowed medical marijuana since peterson sees recreational pot alternative visitors cocktails apiece inflict hangovers waitresses begin delivering highgrade marijuana clubs las vegas strip weed proponents voters narrowly initiative polls riskaverse casino industry nevada resort association measure pointing gambling regulators casino owners avoid marijuana industry substance remains illegal federal law las vegas sands owner sheldon adelson bankrolled opposition pouring million fortune campaign raises possibility intoxicated candylike marijuana edibles adelson also contributed million arizona massachusetts antimarijuana donations adelson son died drug overdose wife doctor specializing drug addiction donated millions efforts defeat medical marijuana proposals florida states years casino operators joined fray lesser extent spite libertine reputation rigorously regulated casino industry err conservative avoid scandalizing middleaged tourists bread butter dont game changer tourism virginia valentine president nevada resort association marijuanas potential things attract las vegas convention visitors authority promotes sin citys amenities world neutral issue clyde barrow gambling expert chairs political science department university texasrio grande valley suggests donations indicate casino companies acting interests marijuana industry emerging recreation entertainment casino industrys difficulties attracting millennials marijuana perceived direct competitor casinos entertainment dollars reason legalized marijuana competes alcohol extent competes food beverage sales casinos theres solid statesponsored research legal recreational marijuana affected tourism places legalized although sides point colorado case promarijuana interests cite state study colorado alltime tourism record capping fifth growth weed chalked factors snow years relative competing ski states marijuana opponents refer visit denver tourism bureau logged increasing complaints panhandling marijuana consumption citys downtown corridor denver losing visitors valuable convention business result overall safety perception safety issues fear able brand denver away growing reputation nevadas ballot initiative allow municipalities blanket bans marijuana colorado bar consumption buildings public permit local governments restrict locations marijuana dispensaries businesses effectively blocks growing banning practice miles licensed marijuana store.
Alex Ansary,2016-11-07T20:01:08.914+02:00,amtvmedia.com,Fake,Quake oklahoma oil hub causes substantial damage.,Russia China autonomous financial system Russia China autonomous financial system minimally subject political risks external pressure Russian prime minister dmitry medvedev Chinese central television cctv guided creating modern financial system peoples republic China Russian federation modern protected simultaneously autonomous financial system subject political risks lesser degree nowadays Russia China considering integration russias national payment system mir bank cards chinas unionpay system enhance reliability payments medvedev adding countries trying exert sorts political pressure european banks regularly fined financial authorities financial companies billion euros french bank billion euros german bank european partners agree medvedev speaking nature disputes protect financial systems China protect system Russia protect system cooperation situation noone capable blocking road financial traffic emphasized Russia looks predictability chinas economic growth Russia expects chinas economic growth predictable cooperate Chinese partners purpose russias prime minister interested predictability chinas economy growth Chinese partners medvedev adding Russian government implementing plan aimed boost economic growth everyone needs country needs plunged phase decline european economies since gaining growth nothing japan also Chinese economy needs since gathering speed years slowed closely everyone chinas economy factor world economic growth energy technology sectors Russia China goal bln trade energy technology sectors traditional trade gear Russian prime minister indicators improving result joint states countries leaders governments ministries agencies businesses medvedev Russia China intend satellite wifi network convinced ahead able trade billion worth attention key aspects cooperation explaining implied energy sector projects power siberia gas pipeline construction eastern stretch gas pipeline launched also includes oil supplies skovorodinomohe oil pipeline extension construction facilities construction unit tianwan nuclear power plant hightech projects enhanced mean widebody jets helicopters projects hightech sector medvedev seems diversify trade countries capable reaching level agreed years conclusion.
Alex Ansary,2016-11-07T21:48:27.296+02:00,amtvmedia.com,Fake,Las vegas amsterdam.,Saudi economic slump press experts outlook saudi economic recovery murky months warning economic slump kingdom reuters quoted riyadhbased experts saying degree uncertainty status saudi economy mainly result remaining challenges private sector saudi economy escaped fiscal currency crisis loomed experts threats basic problems haunt kingdom government owes success temporarily escape crisis unpaid bills sustainable spending cuts government reduced suspended payments owed construction firms medical establishments foreign consultants design economic reforms reuters quoting experts estimated unpaid dues construction firms alone totaled billion riyals experts warned store obligations riyadh future reuters elsewhere emphasized signs economic slump riyadh cities discounts percent stores selling clothes consumer electronics surge offering secondhand cars biggest uncertainty authorities push key reform drive issue saudis determining plan foster vibrant private sector depend oil revenues pushing ahead austerity policies suppressing private demand experts also warned status saudi job market years million million saudi arabias million foreign workers couple years economic slowdown causes layoffs government seeks steer saudi citizens jobs previously held foreigners reuters.
Alex Ansary,2016-11-07T21:48:27.739+02:00,amtvmedia.com,Fake,Russia China autonomous financial system.,Charge comey treason flush entire FBI todays christopher greene amtv reports FBI director james comey dropping investigation Hillary clintons emails times nevada legal brothels roundtheclock casinos coy catchphrase declaring happ Russia China autonomous financial system Russia China autonomous financial system minimally subject politic saudi economic slump press experts outlook saudi economic recovery murky months amtv.
Alex Ansary,2016-11-07T21:48:28.350+02:00,amtvmedia.com,Fake,Saudi economic slump.,Military prepares shut russias hacks election daily caller American hackers russias communications networks electrical grid government systems preparation retaliatory cyber strike Russian hackers meddle election nbc expect attacks infrastructure tantamount act war concerned Russian hackers meddle election spreading hacker guccifer cyber security experts believe Russian intelligence claimed monitoring elections system preparations Russia chinas probing networks penetration caused damage Russia equivalent military scouting mission cyber weapons deployed suffered attack nbc scenario though Obama administration issued backchannel warning Russia stay election youd gain access network youd establish presence network youre poised network gary brown former legal adviser cyber command nbc cyber capabilities line Obama administration wary deploying despite consistent Russian provocation national security agency agencies responsible cyber security incredibly secretive capabilities wellknown publicized cyber weapon highly advanced computer worm wreaked havoc irans nuclear enrichment program involved cyber attacks islamic state pentagon silent exact cyber bombs dropped terrorist Russia target misinformation campaigns attacks infrastructure.
Alex Ansary,2016-11-08T00:16:26.979+02:00,amtvmedia.com,Fake,Charge comey treason flush entire FBI.,Rawalpindi islamic republic pakistan president vladimir Putin asia times moscow comprehensive roadmap solve kashmirs crisis festered decades Russian proposal supports selfdetermination inhabitants disputed jammu kashmir choice courses voted referendum years establishment peace unrealistic expect Muslim population accept idea integration india inalienable kashmiri determine future unsponsored ceasefire staterun asia quoted Putin saying adding indian army disguised hindu zealots indiscriminately targeting Muslim civilians antiindian kashmiri opposition party widely azad kashmir kashmir reopened political office moscow years Russia suddenly severed ties Muslim separatists indian army acts ruthless bandits though seek permanent solution conflict kashmir hold plebiscite disputed areas determine wishes kashmiris final disposition state sideindianans pakistaniseventually mutual understanding agree reasonable term bloodshed.
